Country,Framing,Keyword,Sentence
Italy,Restriction/risk-oriented,compliance,"This is a highly elaborate process, which must initially be based on the definition of specific guidelines directed towards the use of platforms developed in Italy and aimed at the implementation of projects that promote: (i) full compliance with national and European Union regulations in terms of risk Description class management and related compliance, with particular reference to the protection of personal data; (ii) awareness of the requirements dictated by national strategies and related to the development of technologies in highly critical sectors such as energy, defense, and intelligence; (iii) the definition of initiatives aimed at training personnel that can elevate the level of user competencies on advanced technological solutions, focused on the development of certifiable, scalable, and nationally shareable processes."
Italy,Restriction/risk-oriented,compliance,"On the strictly administrative front, systems Description could be defined, for example, for verifying the compliance of acts and administrative decisions with current laws, procedures, and regulations, but especially systems capable of providing automated feedback and recommendations, particularly in the drafting of acts by officials and public managers."
Italy,Innovation-oriented,innovation,"PA.6 | AI IN SCHOOLS FOR PUBLIC ADMINISTRATION To support the innovation processes of Public Administration, it will be necessary to promote specific upskilling paths that allow for the expansion of skills and knowledge of the currently serving staff."
Italy,Innovation-oriented,innovation,"This initiative may also serve as a preparatory step for launching future innovation actions in Public Administration, including through projects in collaboration with universities and centers."
Italy,Innovation-oriented,innovation,24 STRATEGY FOR ENTERPRISES Capture the innovation needs of Italian businesses Objectives Support the Italian ICT sector I.1 | Facilitators for AI in SMEs I.2 | Support for the development and adoption of AI solutions Strategic I.3 | Labs for the development of AI applications in industrial contexts Actions I.4 | Development of startups in the AI field I.5 | Services for ICT companies on AI med at enhancing their distinctive traits.
Italy,Innovation-oriented,innovation,"Italy is a major industrial country with a cio-technical system and leverage the ongoing initiati- strong manufacturing vocation, historically at the fo- ves of technology transfer to SMEs and their collabora- refront of innovation and automation."
Italy,Innovation-oriented,innovation,"be on enhancing the role of Italian ICT companies as enablers for the development of new AI solutions and Objectives applications, increasing their ability to develop project initiatives, promoting their capacity to synergize with • Capture the innovation needs of Italian enter- universities and research centers, and facilitating the prises, financing and supporting an AI-centered definition of networks of relationships within the na- ecosystem that can qualify a perspective where tional context that can create levels of expertise and excellence is enhanced by technological solutions critical mass, in specific technological and application aimed at enhancing their distinctive traits."
Italy,Innovation-oriented,innovation,"• Support the Italian ICT sector, promoting its Parallel to the actions aimed at the ICT world, the stra- enabling role for the definition of new AI applica- tegy for businesses must also address the world that tions, also with initiatives that respond to precise does not directly operate in the development of te- demands for innovation in the productive fabric; chnological solutions but, conversely, receives signifi- increase the possibilities to intercept funding for cant stimuli for the innovation of its value chain from developing new AI project initiatives; support and this world."
Italy,Innovation-oriented,competitiveness,"the need to reorient strategies towards a centrality of data and AI for business competitiveness, also in view of future challenges on environmental sustainability."
Italy,Innovation-oriented,innovation,"In defining strategies consistent with this vision, it will also be necessary to take into account the pecu- liarities of the Italian productive fabric, designing and affirming an AI-driven innovation ecosystem that can qualify a perspective in which the excellence of Italian enterprises is strengthened by innovative solutions ai- 25 Strategic Actions I.1 | AI FACILITATORS FOR SMES To fully leverage the enormous potential of Artificial Intelligence within the productive and entrepreneurial context, a pervasive activity of promoting solutions and developing applications that are concretely usable in specific verticals such as automation, agri-food, furniture, clothing, tourism, chemical and pharmaceutical sectors, and aerospace will be necessary."
Italy,Innovation-oriented,innovation,"To this end, an ecosystem of facilitators will be defined, rooted in the territory, under the direct control of the Foundation for Artificial Intelligence which manages the implementation, coordination, and monitoring, and in strong synergy with all the current actors of the innovation ecosystem, and other relevant foundations in the sector, such as FAIR, Chips.IT, and AI4Industry."
Italy,Innovation-oriented,innovation,"Each facilitator will be able to collaborate with universities and research centers and will cover one or more productive supply chains, becoming a natural meeting point between ICT companies that offer solutions for innovation and the enterprises that benefit from such technologies."
Italy,Innovation-oriented,innovation,"Description The facilitators will therefore be characterized as: (i) an entity that provides innovation services based on AI, such as the assessment of the technological maturity of companies and the characterization of the needs/opportunities for innovation; (ii) an enabler of usable solutions, also in terms of interoperability, for companies in the supply chain; in particular, Italian ICT companies will be involved to develop AI solutions that bring to common factor the needs shared by at least an entire supply chain, then delegating to individual entities any verticalizations and further customizations; (iii) a vehicle through which to collect and codify the characteristic data of the arts and crafts distinctive of the verticals, using them for the training of Artificial Intelligence solutions and feeding the National Knowledge Heritage (Action A.1); (iv) an entity that raises awareness and promotes the training of human resources; (v) a certifier of digital and AI competences within companies; (vi) a creator of synergies between large enterprises, market-leading companies (tier 1) and SMEs, fostering technology transfer; (vii) an entity that supports the development of start-ups (also through synergies with existing incubators) and facilitates their interconnection with the system of enterprises using AI."
Italy,Innovation-oriented,innovation,"The projects can be promoted Description by networks of companies or individual companies and will be facilitated with a variety of systems: conventional finance to support AI investment projects at the individual company level; corporate venture capital tools with reference, for example, to AI-driven initiatives that involve supply chains; possible support in terms of private equity; or vouchers to be used for AI-based innovation support activities in the facilitators mentioned in action I.1."
Italy,Innovation-oriented,investment,"The projects can be promoted Description by networks of companies or individual companies and will be facilitated with a variety of systems: conventional finance to support AI investment projects at the individual company level; corporate venture capital tools with reference, for example, to AI-driven initiatives that involve supply chains; possible support in terms of private equity; or vouchers to be used for AI-based innovation support activities in the facilitators mentioned in action I.1."
Italy,Innovation-oriented,growth,26 I.3 | LABORATORIES FOR THE DEVELOPMENT OF AI APPLICATIONS IN INDUSTRIAL CONTEXTS A crucial element for the growth of the productive fabric in Italy is the ability to develop coordinated projects that facilitate collaboration between enterprises and universities.
Italy,Innovation-oriented,competitiveness,"27 I.4 | DEVELOPMENT OF START-UPS IN THE AI SECTOR In the realm of development and application of Artificial Intelligence technologies, start-ups are a key element for the overall competitiveness of the productive and entrepreneurial fabric."
Italy,Innovation-oriented,acceleration,"Significant players are already present in Italy with established expertise in incubation and acceleration, and in gathering investments, both in the private sector and within the context of significant academic experiences."
Italy,Innovation-oriented,acceleration,"To this end, the creation of AI-Enterprise labs within universities may be encouraged (based, for example, on the UK model) which offer a dynamic environment where researchers Description can work alongside business professionals, benefiting from acceleration programs, financial support, and specialized consulting."
Italy,Innovation-oriented,competitiveness,"I.5 | SERVICES FOR ICT COMPANIES ON AI The competitiveness of the national industry in the field of Artificial Intelligence will be strongly influenced by the ability of Italian companies to develop solutions and services within a highly dynamic European and global regulatory context, where compliance costs constitute a barrier to market entry."
Italy,Restriction/risk-oriented,compliance,"I.5 | SERVICES FOR ICT COMPANIES ON AI The competitiveness of the national industry in the field of Artificial Intelligence will be strongly influenced by the ability of Italian companies to develop solutions and services within a highly dynamic European and global regulatory context, where compliance costs constitute a barrier to market entry."
Italy,Restriction/risk-oriented,risk,The AI Act mandates CE marking for high-risk AI systems; and additional certification requirements are demanded in specific application contexts.
Italy,Restriction/risk-oriented,risk,"Therefore, it is appropriate to foresee support measures, on one hand, to reduce the burdens of regulatory compliance and certifications for applications, especially those at high risk, and on the other, to encourage small and medium enterprises and startups to access sandboxes."
Italy,Restriction/risk-oriented,compliance,"Therefore, it is appropriate to foresee support measures, on one hand, to reduce the burdens of regulatory compliance and certifications for applications, especially those at high risk, and on the other, to encourage small and medium enterprises and startups to access sandboxes."
Italy,Innovation-oriented,growth,"The goal is to prevent a strategy and related digital skills throughout the education sy- of growth and investment in AI from fueling proces- stem: from Higher Technical Institutes (ITS) to univer- ses of digital knowledge divide that, in the long run, sities, with particular attention to research doctorates."
Italy,Innovation-oriented,investment,"The goal is to prevent a strategy and related digital skills throughout the education sy- of growth and investment in AI from fueling proces- stem: from Higher Technical Institutes (ITS) to univer- ses of digital knowledge divide that, in the long run, sities, with particular attention to research doctorates."
Italy,Innovation-oriented,investment,would undermine the social and economic cohesion of Investment in these activities must also be combined the country.
Italy,Restriction/risk-oriented,risk,"Increasingly advanced skills understanding the proper use of AI, fully grasping its are required in the workplace, and the risk of aliena- advantages and critically assessing its limitations and ting those inadequately trained and unable to meet the risks."
Italy,Restriction/risk-oriented,risk,"To mitigate this risk, it will be essential that teachings on the foundations of Artificial Intelligence be integrated into all university programs, including non-STEM ones, with content tailored to the objectives of specific disciplines."
Italy,Innovation-oriented,opportunity,"To ensure the continuation of this strategic doctoral training opportunity, it will be necessary to consistently support the 5 doctorate programs beyond the first three cycles, through the (co)-financing of at least 40 scholarships per year for each (also promoting the expansion Description of the current partnership)."
Italy,Innovation-oriented,opportunity,"Far from catastrophic scenarios regarding job prospects, it is now increasingly clear that new technologies represent a significant opportunity."
Italy,Innovation-oriented,competitiveness,"The objective is to train individuals with high technological and professional technical skills, in order to systematically contribute to the support of measures for economic development Description and the competitiveness of the production system, related to technological areas considered strategic within the policies of industrial and technological development and ecological transition."
Italy,Innovation-oriented,opportunity,"However, the strategy has referred exclusively to evaluations of effectiveness, avoiding considerations of cost and opportunity that would require value judg- Monitoring of Strategic Areas ments not strictly related to the strategy; nevertheless, the introduction of effectiveness criteria represents a Regarding the strategic area of EDUCATION, the panel step forward in the dissemination of the culture of sel- of experts will take care to analyze some specific KPIs: f-evaluation."
Italy,Innovation-oriented,growth,"On the other hand, a specific measure for all sectors would be difficult and especially costly, so the growth of the Public Administration system will be evaluated by accurately monitoring two important flagship projects: • The impact of initiatives on strategic action PA.5."
Italy,Restriction/risk-oriented,risk,"The AI Act of problems arise, upon which the space and compe- seeks to regulate artificial intelligence through a so-cal- titiveness of Artificial Intelligence systems developed led risk-based approach that imposes varying levels in Italy will depend."
Italy,Restriction/risk-oriented,risk,"Firstly, the support of those who of compliance obligations depending on the risk (low, develop, distribute, or implement AI in understanding medium, or high) that software and intelligent applica- and implementing the complex European and national tions may pose to fundamental rights."
Italy,Restriction/risk-oriented,compliance,"Firstly, the support of those who of compliance obligations depending on the risk (low, develop, distribute, or implement AI in understanding medium, or high) that software and intelligent applica- and implementing the complex European and national tions may pose to fundamental rights."
Italy,Restriction/risk-oriented,risk,"The Agency, with its legal and technological risk, the greater the compliance burdens and respon- expertise, must act as a privileged interlocutor so that sibilities of the developers of intelligent applications."
Italy,Restriction/risk-oriented,compliance,"The Agency, with its legal and technological risk, the greater the compliance burdens and respon- expertise, must act as a privileged interlocutor so that sibilities of the developers of intelligent applications."
Italy,Innovation-oriented,innovation,"over-regulation complicated by overlapping discipli- nes and competencies among Authorities, represents However, a crucial role will be played by National Au- a problem that the Agency will need to help simplify thorities, which according to the AI Act, “each Mem- to allow an intelligible application, fostering the pro- ber State shall establish or designate.” Specifically, duction system and innovation."
Italy,Restriction/risk-oriented,compliance,"Abstracting from the specific de- maintain close collaboration with the National Cy- tails, the former is aimed at ensuring that the AI Act bersecurity Agency (ACN), given the crucial role that is respected by manufacturers and distributors of AI AI plays in the sector and the implications for regula- systems; the notification function, on the other hand, tory compliance (consider, for example, the emerging involves verifying the regularity of certification activi- issues of attributing responsibility for cyber-attacks ties issued by third parties to creators of artificial intel- using AI tools)."
Italy,Restriction/risk-oriented,risk,"On the other hand, the supervisory ligence systems that fall into the high-risk categories."
United States,Innovation-oriented,innovation,"To secure our future, we must harness the full power of American innovation.” Donald J."
United States,Innovation-oriented,innovation,1 Pillar I: Accelerate AI Innovation ..............................................................................................
United States,Innovation-oriented,innovation,14 Develop a Grid to Match the Pace of AI Innovation ......................................................................
United States,Innovation-oriented,competitiveness,"President Trump took decisive steps toward achieving this goal during his first days in office by signing Executive Order 14179, “Removing Barriers to American Leadership in Artificial Intelligence,” calling for America to retain dominance in this global race and directing the creation of an AI Action Plan.1 Winning the AI race will usher in a new golden age of human flourishing, economic competitiveness, and national security for the American people."
United States,Innovation-oriented,leadership,"President Trump took decisive steps toward achieving this goal during his first days in office by signing Executive Order 14179, “Removing Barriers to American Leadership in Artificial Intelligence,” calling for America to retain dominance in this global race and directing the creation of an AI Action Plan.1 Winning the AI race will usher in a new golden age of human flourishing, economic competitiveness, and national security for the American people."
United States,Innovation-oriented,opportunity,The opportunity that stands before us is both inspiring and humbling.
United States,Innovation-oriented,innovation,"America’s AI Action Plan has three pillars: innovation, infrastructure, and international diplomacy and security."
United States,Innovation-oriented,leadership,"And the 1 Executive Order 14179 of January 23, 2025, “Removing Barriers to American Leadership in Artificial Intelligence,” Federal Register 90 (20) 8741, www.govinfo.gov/content/pkg/FR-2025-01-31/pdf/2025-02172.pdf."
United States,Innovation-oriented,innovation,"Rubio Assistant to the President for National Security Affairs 2 AMERICA’S AI ACTION PLAN Pillar I: Accelerate AI Innovation America must have the most powerful AI systems in the world, but we must also lead the world in creative and transformative application of these systems."
United States,Innovation-oriented,innovation,Achieving these goals requires the Federal government to create the conditions where private-sector-led innovation can flourish.
United States,Innovation-oriented,leadership,"Remove Red Tape and Onerous Regulation To maintain global leadership in AI, America’s private sector must be unencumbered by bureaucratic red tape."
United States,Innovation-oriented,innovation,"The Federal government should not allow AI-related Federal funding to be directed toward states with burdensome AI regulations that waste these funds, but should also not interfere with states’ rights to pass prudent laws that are not unduly restrictive to innovation."
United States,Innovation-oriented,innovation,"Recommended Policy Actions • Led by the Office of Science and Technology Policy (OSTP), launch a Request for Information from businesses and the public at large about current Federal regulations that hinder AI innovation and adoption, and work with relevant Federal agencies to take appropriate action."
United States,Innovation-oriented,innovation,"• Led by the Federal Communications Commission (FCC), evaluate whether state AI regulations interfere with the agency’s ability to carry out its obligations and authorities under the Communications Act of 1934.5 • Review all Federal Trade Commission (FTC) investigations commenced under the previous administration to ensure that they do not advance theories of liability that unduly burden AI innovation."
United States,Innovation-oriented,innovation,"3 AMERICA’S AI ACTION PLAN and injunctions, and, where appropriate, seek to modify or set-aside any that unduly burden AI innovation."
United States,Restriction/risk-oriented,risk,"Recommended Policy Actions • Led by the Department of Commerce (DOC) through the National Institute of Standards and Technology (NIST), revise the NIST AI Risk Management Framework to eliminate references to misinformation, Diversity, Equity, and Inclusion, and climate change."
United States,Innovation-oriented,innovation,"• Led by DOC through NIST’s Center for AI Standards and Innovation (CAISI), conduct research and, as appropriate, publish evaluations of frontier models from the People’s Republic of China for alignment with Chinese Communist Party talking points and censorship."
United States,Innovation-oriented,innovation,Models distributed this way have unique value for innovation because startups can use them flexibly without being dependent on a closed model provider.
United States,Restriction/risk-oriented,risk,"Currently, a company seeking to use large- scale compute must often sign long-term contracts with hyperscalers—far beyond the 6 National Institute of Standards and Technology, “Artificial Intelligence Risk Management Framework (AI RMF 1.0),” (Gaithersburg, MD: National Institute of Standards and Technology, 2023), www.doi.org/10.6028/NIST.AI.100-1."
United States,Restriction/risk-oriented,risk,"Many of America’s most critical sectors, such as healthcare, are especially slow to adopt due to a variety of factors, including distrust or lack of understanding of the technology, a complex regulatory landscape, and a lack of clear governance and risk mitigation standards."
United States,Innovation-oriented,opportunity,"By accelerating productivity and creating entirely new industries, AI can help America build an economy that delivers more pathways to economic opportunity for American workers."
United States,Innovation-oriented,investment,"• Led by the Department of the Treasury, issue guidance clarifying that many AI literacy and AI skill development programs may qualify as eligible educational assistance under Section 132 of the Internal Revenue Code, given AI’s widespread impact reshaping the tasks and skills required across industries and occupations.9 In applicable situations, this will enable employers to offer tax-free reimbursement for AI-related training and help scale private-sector investment in AI skill development, preserving jobs for American workers."
United States,Restriction/risk-oriented,risk,"Issue clarifying guidance to help states identify eligible dislocated workers in sectors undergoing significant structural change tied to AI adoption, as well as guidance clarifying how state Rapid Response funds can be used to proactively upskill workers at risk of future displacement."
United States,Innovation-oriented,opportunity,"These pilots should be carried out by states and workforce intermediaries using existing authorities under the Workforce Innovation and Opportunity Act and the Public Works and Economic Development Act, and should be designed to identify surface scalable, performance-driven strategies that help the workforce system adapt to the speed and complexity of AI-driven labor market change."
United States,Innovation-oriented,innovation,"These pilots should be carried out by states and workforce intermediaries using existing authorities under the Workforce Innovation and Opportunity Act and the Public Works and Economic Development Act, and should be designed to identify surface scalable, performance-driven strategies that help the workforce system adapt to the speed and complexity of AI-driven labor market change."
United States,Innovation-oriented,investment,The Federal government should prioritize investment in these emerging technologies and usher in a new industrial renaissance.
United States,Innovation-oriented,innovation,"Recommended Policy Actions • Invest in developing and scaling foundational and translational manufacturing technologies via DOD, DOC, DOE, NSF, and other Federal agencies using the Small Business Innovation Research program, the Small Business Technology Transfer program, research grants, CHIPS R&D programs, Stevenson-Wydler Technology Innovation Act authorities, Title III of the Defense Production Act, Other Transaction Authority, and other authorities.12, 13, 14, 15 • Led by DOC through NTIA, convene industry and government stakeholders to identify supply chain challenges to American robotics and drone manufacturing."
United States,Innovation-oriented,opportunity,"10 Workforce Innovation and Opportunity Act of 2014, 29 U.S.C."
United States,Innovation-oriented,innovation,"10 Workforce Innovation and Opportunity Act of 2014, 29 U.S.C."
United States,Innovation-oriented,innovation,"13 Stevenson-Wydler Technology Innovation Act of 1980, Pub."
United States,Innovation-oriented,innovation,Build World-Class Scientific Datasets High-quality data has become a national strategic asset as governments pursue AI innovation goals and capitalize on the technology’s economic benefits.
