Country,Framing,Keyword,Sentence
Germany,Innovation-oriented,competitiveness,"www.ki-strategie-deutschland.de 22 Regulatory framework In addition to fostering competitiveness and innovation in the European Union, one of the Federal Government’s stated aims is the responsible development and use of AI for the benefit of society as a whole."
Germany,Innovation-oriented,innovation,"www.ki-strategie-deutschland.de 22 Regulatory framework In addition to fostering competitiveness and innovation in the European Union, one of the Federal Government’s stated aims is the responsible development and use of AI for the benefit of society as a whole."
Germany,Innovation-oriented,innovation,"In areas where the use of AI entails huge innovation potential, regulation must be careful to encourage rather than hamper innovation."
Germany,Innovation-oriented,innovation,"As the COVID 19 pandemic has highlighted, the regulatory framework needs to be sufficiently flexible to allow innovation to be accelerated when it is a matter of averting major harm to the Community."
Germany,Restriction/risk-oriented,risk,"When developing AI systems, the detection of attacks therefore also needs to be included in any risk assessments."
Germany,Innovation-oriented,opportunity,"The opportunity to have a say and help shape developments has a major role to play in the development, introduction and use of AI."
Germany,Innovation-oriented,innovation,This includes the Civic Innovation Platform project to connect civil society players from all sections of society.
Germany,Innovation-oriented,innovation,"www.ki-strategie-deutschland.de 25 Annex Next steps in the implementation of the AI Strategy The Federal Government will take the following measures in the coming years to continue to implement the AI Strategy: Minds • Expanding the efforts to promote and fund attractive working and research conditions for young researchers at universities of applied sciences • Holding AI challenges and establishing a German award for “AI made in Germany” • Launching further initiatives to promote young researchers, including with the German Academic Exchange Service (DAAD) • Promoting and funding innovation in digital higher education through the vehicles of artificial intelligence and big data • Promoting and funding measures for the training of future academic staff by implementing AI in the curriculum content and measures to improve the quality and performance of higher education through the use of AI (in partnership with the Länder) • Developing a new AI-supported online portal for continuing vocational training • Launching the INVITE (Digital Platform for Continuing Vocational Training) innovation competition projects for the design of an innovative, user-oriented and coherent digital continuing education and training area • In its consultations with the Länder, working towards establishing improved salary structures for AI professors • AI education programmes for young women by experts from regional innovation systems and clusters Research • Developing a globally leading European AI network under the master brand “AI - made in Europe” • Accelerated expansion of the Gauss Centre for Supercomputing to Exascale capability and accompanying measures in high-performance computing • Developing a HPC infrastructure tailored to needs in the scope of joint federal-Länder funding for national high-performance computing for nationwide use by university students and staff • Expanding research and development by the German Aerospace Centre (DLR) for safe and secure AI systems in infrastructures of systemic economic relevance www.ki-strategie-deutschland.de 26 • Launching a new funding initiative for research and development in the field of AI- based assistance systems for medical care and epidemiological prediction • Initiating a new measure to promote and fund research and development of AI systems for long-term care • Expanding the “computational life sciences” funding measure focussing on “AI for digital infection epidemiology” • Expanding the “AI in earth observation” funding measure focussing on innovative applications for sustainable ways of doing business • Intensifying research into the use of trustworthy AI for civil security • Launching a funding measure on learning manufacturing technology - use of artificial intelligence in production • Launching a funding measure for the generation of synthetic data • Launching a new research funding initiative for reliable and trustworthy AI • Intensifying AI use in the scope of the Quantitative Early Crisis Detection and Information Management (PREVIEW) project at the Federal Foreign Office • Establishing Digital Health ProgressHubs to promote data-supported digital medicine with a focus on defined use fields (for instance cancers, infectiology) • Launching projects from the Artificial Intelligence for IT Security and Artificial Intelligence in Communication Networks funding measures • Launching start-up projects from the StartUpSecure funding initiative which contribute to the security of AI-based business models and products • Launching projects from the funding measures for the pilot innovation competition “Energy-efficient AI system”, Future-proof special processors and development platforms (ZUSE) and investments in universities to tap into new research fields for new AI electronics • Intensifying cooperation between public administration and research on regulatory impact assessments relating to tax impacts with AI • Launching the projects from the AI funding measures in agriculture, the food chain, health food and rural areas in the scope of research projects • Research and application of AI systems in the context of digital trial fields in agriculture • Strengthening research on the safety and security and robustness of AI systems • Developing methodology and testing tools to test the properties of AI systems • Putting in place innovation centres for AI and self-learning systems in the field of mobility • Expanding applied research, development and testing on complex autonomous driving scenarios using connected European test fields and living labs • Expanding and further developing the funding initiative AI Flagship Projects for the Environment, Climate, Nature and Resources (KI-Leuchttürme) with the priorities AI innovations for climate protection and “resource-efficient AI” • Intensifying research on the environmental impacts of AI, including a systematic analysis of AI’s CO -saving potential 2 • Implementing a “resource-efficient AI” initiative as the target system for the resource and energy efficiency of AI systems • Setting up a mobility data space for a sustainable mobility data ecosystem linking private and public mobility service providers www.ki-strategie-deutschland.de 27 Transfer and application • Establishing a new AI focus within the current EXIST funding programme for science start-ups with several individual measures • Implementing a targeted funding programme for AI-based start-ups within the international German Accelerator Programme • Developing application centres (including virtual ones) which actively link the Mittelstand 4.0 Centres of Excellence with the AI research centres and involve SMEs in research at an early stage • Expanding the AI trainer programme at the Mittelstand 4.0 Centres of Excellence by funding train-the-trainer programmes and through targeted cooperation with multipliers • Establishing a contact and service point as a networking centre in Silicon Valley, above all for ministries, institutions and individuals from Germany • Establishing a high-performance, efficient and competitive, secure and trustworthy federated data infrastructure through Project GAIA-X • Promoting and funding use cases for SMEs (for instance in the area of Industry 4.0) and agriculture on the basis of GAIA-X • Promoting and funding innovative mobility concepts based on AI focussing on urban mobility, connecting rural areas and public acceptance • Measures to raise awareness and promote the exchange of best practices on the energy and resources used by AI • Developing a digital EMAS platform • Evaluating and testing AI technologies in federal IT projects, for instance in the scope of the IT measures chatbot and service consolidation analytics • Establishing an annual AI transfer conference to link initiatives and institutions dedicated to translating AI into practice • Funding AI to tackle epidemic crises with an innovation competition • Launching a new initiative to promote collaborative research and development projects between German and Canadian industry and research for the use of AI in the context of Industry 4.0 • Expanding funding for the research, development and use of artificial intelligence methods at SMEs • Establishing additional sectoral and domain-specific AI application hubs, including in the field of recycling and the circular economy • Strengthening the promotion of the dissemination of AI technology using established innovation structures • Promoting AI in basic research for the exploration of the universe and matter at large research infrastructures • Using and further developing AI methods in mathematical modelling, simulation and optimisation • Transdisciplinary application and transfer of AI methods in data-intensive systems research in physics, earth system research and systems biology www.ki-strategie-deutschland.de 28 • Promoting AI in aerospace as a key technology and its transfer to other sectors such as car manufacturing and modern mobility, shipbuilding, agriculture and long-term care sectors • AI-based analysis in remote sensing - processing and analysing remote sensing information for the needs of the federal administration using AI • Creating global public goods and implementation capacities in the field of AI together with partner governments from the Global South • Continuing the interdisciplinary innovation award for living labs • Strengthening the legal scope for testing innovations in regulatory sandboxes: Developing specific proposals on how to strengthen the legal scope for regulatory sandboxes and translate the results into general law, based on a number of ongoing expert opinions (for instance on general experimentation clauses, on tools for wording experimentation clauses and on international regulatory sandbox approaches) • Netzwerk Reallabore (regulatory sandboxes): further developing and expanding the living labs network’s services in 2020 on the basis of a survey of network members • Developing an AI in logistics innovation cluster to strengthen the “logistics flagship” (Leuchtturm Logistik) in Germany as an attractive place to do business and to compete in the data and platform economy • Funding and promoting learning and experimental spaces for AI • Further developing the Centre of Excellence for Innovative Procurement (KOINNO) to increase the proportion of innovations procured in the total volume of public procurement in Germany • Establishing an “AI and Big Data Application Laboratory” for the systematic use of AI methods to improve environmental monitoring (inter alia on the basis of in-situ, sensor and remote sensing data) to then develop environmentally relevant measures and to support the environmental administrations at federal and Länder level with their enforcement activities • Expanding the AI Observatory focussing on the development of a system of indicators to monitor developments and trends of AI at work and in society, dealing with questions of the human-centric introduction and use of AI, especially in labour and social administrations and the exploration and design of human-machine interaction • Supporting and developing the GPAI • Expanding the “Zukunftszentren-Ost” (Hubs for the Future East) into a federal programme “Zukunftszentren KI” (Hubs for the Future AI) for future centres in western Germany and Berlin as well • Studies on the use of AI to improve the security and performance of communication and information systems in public administration (network infrastructures and digital radio of security authorities and organisations) • Piloting AI applications in the energy sector under the auspices of the Future Energy Lab at the German Energy Agency • Funding of projects until 2023 under the funding priority: “Digital innovations for the improvement of patient-centred care in the health sector”."
Germany,Innovation-oriented,innovation,"• Establishing a central body for the certification/conformity assessment of any AI systems used by the security authorities to perform public security tasks Society • Developing an ecosystem for AI that serves the common good, including launching the Civic Innovation Platform project, the Civic Data Lab and the Civic Tech Labs for Green • Funding AI applications to support consumers in their everyday lives (known as “consumer enabling technologies”) • Funding and expanding AI projects for the preservation, development, accessibility, networking and communication of cultural programmes • Developing AI skills in categorising and verifying media content to ensure diversity of opinion www.ki-strategie-deutschland.de 30"
France,Innovation-oriented,innovation,"MAKE FRANCE AN AI POWERHOUSE FEBRUARY 10TH AND 11TH, 2025 Table of contents Editorial by the President of the Republic 2 The strategy implemented since 2018 has made France a leader in AI 3 France, a leader in AI .............................................................................................3 France is home to leading companies and a globally recognized R&D hub ...............4 France offers AI solutions tailored to all economic sectors .......................................6 France is developing AI technologies tailored to each modality ................................6 France has an AI ecosystem covering the entire value chain ....................................7 Since 2018, more than €2.5 billion has been invested in research and technology ...9 Its attractiveness is built on several pillars 11 A reputation for talents & formation ....................................................................11 Strengthening public computing infrastructures ...................................................15 Support for innovation through France 2030 ........................................................16 The French territory has many advantages for hosting dedicated AI infrastructure 18 A decarbonized, abundant, and stable electricity supply ........................................18 An ever-expanding high-voltage grid .....................................................................20 Suitable sites for data center projects ...................................................................20 Ready to use low carbon AI-sites through all of France ..........................................21 Streamlined procedures ......................................................................................22 Editorial by the President of the Republic A STRONG POLITICAL VISION FOR THE DEVELOPMENT OF ARTIFICIAL INTELLIGENCE IN FRANCE France has everything it needs to secure its place in the AI revolution."
France,Innovation-oriented,opportunity,"Funding and the AI summit will be an opportunity to highlight historic levels of public and private investments, driven by French, European, and international players."
France,Innovation-oriented,innovation,"In this regard, France aims to host and reinforce its talents, corporates, as well as cutting-edge infrastructures for the development and use of AI, to serve its innovation ecosystem, from startups to industry and research laboratories."
France,Innovation-oriented,growth,"FRANCE, A LEADER IN AI France is experiencing rapid growth in the field of artificial intelligence (AI)."
France,Innovation-oriented,innovation,"Thanks to sus- tained innovation dynamics, world’s top-level talents, record fundraising, and the establish- ment of major international players, the French AI ecosystem is developing and structuring itself at an unprecedented pace."
France,Innovation-oriented,investment,"+ de 1,000 1sT European €1.9 bn IA startups country for raised in AI in 2025 foreign investment in 2024 projects in AI The structuring of French investment funds, coupled with the attractiveness of France for foreign investments, enables world-class AI companies to grow."
France,Innovation-oriented,investment,"France has been the top destination in Europe for foreign investment projects in AI for over five years, according to the EY barometer."
France,Innovation-oriented,innovation,"5 FRANCE OFFERS AI SOLUTIONS TAILORED TO ALL ECONOMIC SECTORS FRANCE IS DEVELOPING AI TECHNOLOGIES TAILORED TO EACH MODALITY 6 FRANCE HAS AN AI ECOSYSTEM COVERING THE ENTIRE VALUE CHAIN 7 A POLICY FOCUSED ON INNOVATION AND ATTRACTIVENESS 8 SINCE 2018, MORE THAN €2.5 BILLION HAS BEEN INVESTED IN RESEARCH AND TECHNOLOGY The first phase of the €1.5 billion National AI Strategy (2018-2022) has helped to struc- ture a strong research ecosystem."
France,Innovation-oriented,innovation,"PHASE 1 → Creation of 4 institutes 180 research chairs 3 IA €1.5 bn 300 doctoral programs → Construction of the to structure Jean Zay supercomputer > 40,000 students trained research → Creation of the Health in AI per year Data Hub Since 2022, the second phase, supported by €1 billion via the France 2030 investment plan, aims to make this technology a transformative lever for production and innovation."
France,Innovation-oriented,investment,"PHASE 1 → Creation of 4 institutes 180 research chairs 3 IA €1.5 bn 300 doctoral programs → Construction of the to structure Jean Zay supercomputer > 40,000 students trained research → Creation of the Health in AI per year Data Hub Since 2022, the second phase, supported by €1 billion via the France 2030 investment plan, aims to make this technology a transformative lever for production and innovation."
France,Innovation-oriented,innovation,"PHASE 2 → Creation of 9 excellence From 40,000 to 100,000 training hubs: students trained in AI €1 bn “AI Clusters” per year to accelerate → Expansion of the €400 m in direct aid for innovation Jean Zay supercomputer public and private R&D With phase 3, the State supports the deployment of strategic infrastructures and pro- motes a broader adoption of AI within society, businesses, and public services."
France,Innovation-oriented,acceleration,"PHASE 3 → C ontinuation of investments in research and training Accelerated → Acceleration of AI deployment in businesses and public services the spread → Implementation of “AI Cafés” to foster democratic debate on AI → Creation of the first European institute for AI evaluation and security (INESIA) 9 HELPING THE PUBLIC UNDERSTAND AND EMBRACE AI In May 2024, the President of the Republic tasked the National Digital Council (CNNum) with creating a national initiative for democratic debate and educational outreach on artifi- cial intelligence, known as “AI Cafés”."
France,Innovation-oriented,investment,2nD in the EU 7TH position in terms worldwide in terms of publications of publications in at AI scientific AI-related scientific conferences conferences 11 Investment in training is a cornerstone of our strategy.
France,Innovation-oriented,innovation,SUPPORT FOR INNOVATION THROUGH FRANCE 2030 FRANCE 2030 FOR STRENGTHENING OUR COMPUTING INFRASTRUCTURES AND CRITICAL LINKS IN THE AI VALUE CHAIN Public supercomputers are a major asset in providing an alternative to the American cloud giants.
France,Innovation-oriented,innovation,We will support breakthrough innovation in the chip and middleware sector.
France,Innovation-oriented,innovation,16 FRANCE 2030 SERVING R&D AT THE TECHNOLOGICAL FRONTIER Excellence in research and innovation is key to positioning France among the leaders in AI.
France,Innovation-oriented,acceleration,"This status allows for the acceleration of local urban planning rule adjustments (if necessary), the securing of exemptions for species protection (if necessary), and guarantees a fast connection to the electrical grid."
France,Innovation-oriented,investment,An announcement regarding the first phase of investment will be made at the Choose France 2025 Summit.
France,Innovation-oriented,opportunity,"This investment includes increased Amazon Web Services cloud infrastructure, to support France’s flourishing generative AI opportunity."
France,Innovation-oriented,investment,"This investment includes increased Amazon Web Services cloud infrastructure, to support France’s flourishing generative AI opportunity."
France,Innovation-oriented,investment,Our investment is part of a €6 billion investment plan to expand cloud infrastructure in France through to 2031.
France,Innovation-oriented,investment,"→ APOLLO (USA): Apollo, a leading global provider of long-duration capital solutions at scale, to provide capital to power next-gen infrastructure in France Advancing leading-edge AI capabilities will require substantial investments in infrastruc- ture, with over $1 trillion of investment expected globally by 2030."
France,Innovation-oriented,growth,Apollo is working diligently on several projects and is prepared to finance Energy Projects with up to €5.0 billion of long-term capital and believes its capital base can assist France’s AI competitiveness while meeting the growing need for energy to power economic growth.
France,Innovation-oriented,competitiveness,Apollo is working diligently on several projects and is prepared to finance Energy Projects with up to €5.0 billion of long-term capital and believes its capital base can assist France’s AI competitiveness while meeting the growing need for energy to power economic growth.
France,Innovation-oriented,investment,"Up to €15 billion of datacenter investment will be led by Brookfield’s portfolio company, Data4, one of Europe’s largest datacenter developers, headquartered in Paris."
France,Innovation-oriented,investment,"A further €5 billion of investment is planned in associated AI infrastructure, including potentially data transfer, chip storage and energy, from future investments made by Brookfield in France."
France,Innovation-oriented,investment,"23 → DIGITAL REALTY (USA): since the start of La Courneuve Digital Park in 2020 (fully completed in 2025), Digital Realty is investing and will invest significantly in data centers throughout Paris and Marseille regions, with 13 new datacenters and a total investment value over €5 billion."
France,Innovation-oriented,investment,"After the delivery to its Bruyères-le-Châtel (Ile de France) site of the first platform exclu- sively dedicated to hosting supercomputers for AI and scientific computing, with a final power of 100MW, Eclairion announces a new investment phase for the start of con- struction on a second site."
France,Innovation-oriented,innovation,"→ EQUINIX (USA): Equinix, the world’s digital infrastructure company, has always con- sidered France a critical market for IT innovation, connectivity and low carbon abundant electricity and is committed to providing the infrastructure needed to drive France’s AI leadership."
France,Innovation-oriented,leadership,"→ EQUINIX (USA): Equinix, the world’s digital infrastructure company, has always con- sidered France a critical market for IT innovation, connectivity and low carbon abundant electricity and is committed to providing the infrastructure needed to drive France’s AI leadership."
France,Innovation-oriented,investment,"Equinix is making significant investments in France, with additional invest- ments of more than €630 million planned and the roll-out of its €750M investment plan announced in 2022, with 10 data centers operating in Paris and 1 in Bordeaux."
France,Innovation-oriented,investment,"Equinix, with the French government’s strong support, is committed to bold expansion and long- term investment in the market → EVROC (Sweden): evroc, the European cloud company, will build its first AI factory in Mougins, France, creating a 96 MW hyperscale datacenter with a designed capacity for up to 50,000 GPUs."
France,Innovation-oriented,investment,"Supported by an initial €10 billion investment, this project aims to position France as a global leader in AI by leveraging nuclear power, a 100% car- bon-free energy source."
France,Innovation-oriented,innovation,"Scheduled for launch in 2026, this supercomputer will accelerate innovation, strengthen France’s digital sovereignty, and create thousands of skilled jobs across the region."
France,Innovation-oriented,investment,The investment amounts to €400 million.
France,Innovation-oriented,growth,This scalable datacenter will support Mistral AI's growth and its research and development activities.
France,Innovation-oriented,growth,→ PROLOGIS (United States) announces an investment of over €3.5 billion to support the growth of artificial intelligence in France.
France,Innovation-oriented,investment,→ PROLOGIS (United States) announces an investment of over €3.5 billion to support the growth of artificial intelligence in France.
France,Innovation-oriented,investment,25 → SESTERCE (France): the French company Sesterce is launching a major investment plan for the deployment of AI infrastructure in France.
France,Innovation-oriented,investment,"In the first phase of the project, Sesterce would deploy a datacenter in Drôme to provide its training and inference ser- vices and host computing capacity, for an investment of 400 million euros."
