Country,Framing,Keyword,Sentence
China,Innovation-oriented,innovation,"No.17 Department of International Cooperation Ministry of Science and Technology(MOST), P.R.China (cid:52)(cid:70)(cid:81)(cid:85)(cid:70)(cid:78)(cid:67)(cid:70)(cid:83)(cid:15)(cid:18)(cid:22)(cid:1)(cid:19)(cid:17)(cid:18)(cid:24) Next Generation Artifi cial Intelligence Development Plan Issued by State Council China’s Strengths Creates Innovation Miracles SSppoonnssoorr:: DDeeppaarrttmmeenntt ooff IInntteerrnnaattiioonnaall CCooooppeerraattiioonn,,MMiinniissttrryy ooff SScciieennccee aanndd TTeecchhnnoollooggyy((MMOOSSTT)),, PP..RR..CChhiinnaa OOrrggaanniizzeerr:: CChhiinnaa AAssssoocciiaattiioonn ffoorr IInntteerrnnaattiioonnaall SScciieennccee aanndd TTeecchhnnoollooggyy CCooooppeerraattiioonn ccaaiissttcc@@112266..ccoomm Next Generation Artificial Intelligence Development Plan Issued by State Council Over 60 years of progress has witnessed booming of new theories and new technologies including mobile Internet, big data, super computing, sensor network and brain science."
China,Innovation-oriented,innovation,"The general advancement of AI-related disciplines, theoretical modeling, technological innovation and software and hardware update is triggering a chain of breakthroughs, boosting transformation from digitization and Internetization to intelligentization in all aspects of social and economic sphere."
China,Innovation-oriented,opportunity,"In light of new circumstances and demands, we need to take proactive approaches to meet changes, seize the historical opportunity of AI development and take stock of the current situation and make proactive plans to serve socioeconomic development and national security and to lead leapfrog advancement of national competitiveness."
China,Innovation-oriented,competitiveness,"In light of new circumstances and demands, we need to take proactive approaches to meet changes, seize the historical opportunity of AI development and take stock of the current situation and make proactive plans to serve socioeconomic development and national security and to lead leapfrog advancement of national competitiveness."
China,Innovation-oriented,opportunity,"Next Generation Artifi cial Intelligence Development Plan Introduction Artificial intelligence (AI) has become new focus of international economy, new engine of economic development and new opportunity of social development."
China,Innovation-oriented,opportunity,"To seize the major strategic opportunity brought by AI development, build up our AI fi rst mover advantage and speed up building innovation-driven and globally advanced science and technology country, we formulated this plan according to deployment requirements of the Central Government and the State Council."
China,Innovation-oriented,innovation,"To seize the major strategic opportunity brought by AI development, build up our AI fi rst mover advantage and speed up building innovation-driven and globally advanced science and technology country, we formulated this plan according to deployment requirements of the Central Government and the State Council."
China,Innovation-oriented,innovation,AI innovation and entrepreneurship are growing rapidly with a group of leading businesses gaining wide international awareness and recognition.
China,Innovation-oriented,growth,AI industry becomes new economic growth point.
China,Innovation-oriented,innovation,AI technological application becomes new approach to improving people’s livelihood to support our goal in becoming an innovation-driven country and building a moderately prosperous society in all respects.
China,Innovation-oriented,innovation,China becomes global AI innovation center.
China,Innovation-oriented,innovation,"Intelligence economy and society make marked progress, laying a solid foundation for becoming an innovation-driven and economically powerful country."
China,Innovation-oriented,innovation,"Major Task Set up a system Stick to Three in One Open and coordinated AI science R&D, product application and and technology innovation system industrial cultivation Seize double nature Enhance Four Supports Highly integrate technical nature Support technology, economy, social and social nature development and national security Next Generation Artificial Intelligence Development Plan Issued by State Council We must take into account the overall situation of national development, grasp global AI development trend, find the breaking point and priority, enhance basic capacity for technological innovation, expand the depth and scope for application of major areas and improve intelligence level of social and economic development and national defense application."
China,Innovation-oriented,innovation,Set up open and coordinated AI science and technology innovation system Set up basic theory system of next generation AI (1) big data intelligence theory (2) cross-media perceptual computing theory (3) hybrid augmented intelligence theory (4) group intelligence basic theory (5) coordinated control and decision-making theory (6) advanced machine learning theory (7) brain-like intelligence computing theory (8) quantum intelligence computing theory Set up next generation key AI generic technology system (1) knowledge computing engine and knowledge service technology (2) cross-media analytic reasoning technology (3) key group intelligence technology (4) new structure and new technology of hybrid augmented intelligence (5) autonomous man-less system technology (6) virtual reality intelligence modeling technology (7) intelligence computing chip and system (8) natural language processing technology Next Generation Artificial Intelligence Development Plan Issued by State Council Coordinate the set-up of AI innovation platform (1) basic platform for AI open source software and hardware (2) group intelligence service platform (3) hybrid augmented intelligence support platform (4) independent man-less system support platform (5) AI basic data and safety assessment platform Accelerate the cultivation of high-level AI talents (1) cultivate high-level AI innovation talents and team (2) Make more efforts to bring in high-level AI talents (3) Set up AI discipline 2.
China,Innovation-oriented,innovation,"Set up AI innovation highland Carry out demonstration for AI application, build national AI industrial park and national maker space for AI."
China,Innovation-oriented,innovation,"refers to major S&T programs of next generation AI refers to major national special S&T programs, S&T innovation 2030 and National Key R&D program “1” refers to major technology projects of next generation AI."
China,Innovation-oriented,innovation,"It enhances its mutual support with other “technology innovation 2030--major projects”, speeds up research on brain science and brain-like computing, quantum information and quantum computing, intelligent manufacturing and robots and big data, providing support for technological breakthroughs in AI."
China,Innovation-oriented,innovation,"Next Generation Artificial Intelligence Development Plan Issued by State Council Resource distribution Fully capitalize on existing resources like capital and base, holistically allocate domestic and international innovation resource, prioritize the set-up of AI innovation base, give play to the guiding role played by fiscal revenue and policy incentives and dominant role played by market to distribute resource, build a new pattern supported by fi scal, fi nancial and social capital."
China,Restriction/risk-oriented,risk,"We need to enhance research and assessment of AI infl uence on national security and confi dentiality, improve safety prevention and protection system featuring human, technology, product and management, build up warning mechanism for AI safety monitoring, enhance research into prediction, assessment and trace of AI technology development, stick to problem-oriented approach and grasp technological and industrial development trend, pay attention to risk assessment and prevention, strengthen forward-thinking prevention and guidance, set up open and transparent AI monitoring system, carry out two-level monitoring structure with accountability and monitoring for application, promote AI industrial and business discipline, enhance management and punish data abuse, privacy infringement and unethical behavior."
China,Innovation-oriented,innovation,"Organization and implementation 1.Organization and leadership According to the deployment of the Central Government and the State Council and coordinated by Steering Group for National Science and Technology System Reform and Innovation System Building, we examine and deliberate on major tasks, policies, issues and work arrangement, promote AI-related laws and regulations, guide, coordinate and supervise related departments to make related plans."
China,Innovation-oriented,leadership,"Organization and implementation 1.Organization and leadership According to the deployment of the Central Government and the State Council and coordinated by Steering Group for National Science and Technology System Reform and Innovation System Building, we examine and deliberate on major tasks, policies, issues and work arrangement, promote AI-related laws and regulations, guide, coordinate and supervise related departments to make related plans."
China,Innovation-oriented,innovation,"(Source: website of the State Council, July 20, 2017) China’s Strengths Creates Innovation Miracles The previous 5 years has witnessed the Chinese people making great endeavors under the leadership of the Communist Party of China for STI miracles."
China,Innovation-oriented,leadership,"(Source: website of the State Council, July 20, 2017) China’s Strengths Creates Innovation Miracles The previous 5 years has witnessed the Chinese people making great endeavors under the leadership of the Communist Party of China for STI miracles."
China,Innovation-oriented,innovation,"For the past 5 years, China has transformed from relying on resource and labor force dividend to “Lead by Innovation” mode, becoming increasingly important in global innovation pattern."
China,Innovation-oriented,innovation,"China’s Stregnths: “5 Golden Years” Creates Innovation Miracles China, the largest developing country in the world, places great emphasis on science and technology innovation, sounding the horn of building a global science and technology power."
China,Innovation-oriented,innovation,"Over the past year alone, “transcript” of innovation in China is great enough for national pride and global applause: The first independently-manufactured aircraft carrier makes its debut New type 10,000-ton destroyer enters the water First self-developed bullet train Fuxing makes its debut Quantum Space Satellite Mozi shines in outer space Extracted combustible ice for 60 days, setting two world records of longest extract time and largest gas volume."
China,Innovation-oriented,competitiveness,"China’s Strengths Creates Innovation Miracles 2017 World Competitiveness Yearbook Report shows: published by Swiss-based International Institute for Management Development In ranking of the most competitive global economies, Chinese mainland has elevated to No.18 and ranked the 2nd in global Economic Performance."
China,Innovation-oriented,innovation,"China’s Strengths Creates Innovation Miracles 2017 World Competitiveness Yearbook Report shows: published by Swiss-based International Institute for Management Development In ranking of the most competitive global economies, Chinese mainland has elevated to No.18 and ranked the 2nd in global Economic Performance."
China,Innovation-oriented,competitiveness,China’s international competitiveness has ranked among the top of all developing countries.
China,Innovation-oriented,innovation,Report shows: Global Innovation Index 2017 Report China has climbed from No.25 last year to No.22 this year and was the only medium income country that entered top 25.
China,Innovation-oriented,innovation,"China power: independent innovation reshapes world science and technology pattern How far is 380,000 km?"
China,Innovation-oriented,innovation,Only by innovation can we master our own fate.
China,Innovation-oriented,innovation,China’s Strengths Creates Innovation Miracles Why is China’s innovation rise possible?
China,Innovation-oriented,innovation,Talents breed the soil for innovation and are our inexhaustible rich ore.
China,Innovation-oriented,innovation,"170 million 81 million science workers highly educated or skilled talents Sustainable input is like flowing water, irrigating prosperous China’s Innovation Era."
China,Innovation-oriented,innovation,China’s R&D expenditure is approaching that of the whole EU.” China’s Strengths Creates Innovation Miracles Good policy is like sunshine.
China,Innovation-oriented,innovation,Furthered S&T reform solves innovation formula.
China,Innovation-oriented,competitiveness,"To consolidate national core competitiveness, important plans like National Guideline for Innovation-Driven Development Strategy and National Science and Technology Innovation Plan for 13th Five-Year Plan Period have been issued to enhance S&T supply, consolidate its foundation, boost strategy orientation, deepen innovation reform and clarify positioning of S&T innovation."
China,Innovation-oriented,innovation,"To consolidate national core competitiveness, important plans like National Guideline for Innovation-Driven Development Strategy and National Science and Technology Innovation Plan for 13th Five-Year Plan Period have been issued to enhance S&T supply, consolidate its foundation, boost strategy orientation, deepen innovation reform and clarify positioning of S&T innovation."
China,Innovation-oriented,innovation,"Streamline administration and increase innovation and business, carry out distribution policy that is knowledge- and value-oriented to mobilize mass innovation and entrepreneurship."
China,Innovation-oriented,innovation,"Innovation Confi dence: look forward to reaching innovation summit In 2018, Beidou Navigation Satellite System will cover major countries along the Belt and Road."
China,Innovation-oriented,innovation,China’s Strengths Creates Innovation Miracles Climb to science and technology summit with steadfast steps of Chinese characteristics.
China,Innovation-oriented,innovation,"Innovation creates China Heart We will continue to carry out the special project of core electronic component, high-end common chip and basic software, set up Aero Engine Corporation of China (AECC), mobilize our strengths to make breakthroughs in integrated circuit, engine and gas turbine to get the “Pearl of Industrial Crown” as soon as possible."
China,Innovation-oriented,innovation,"Further reform, consolidate foundation and highlight environment About 90% of modern technology innovation findings stem from basic research."
China,Innovation-oriented,innovation,We need to make more efforts into basic research and make more innovations and create fl exible innovation environment.
China,Innovation-oriented,innovation,China’s Strengths Creates Innovation Miracles Launch the first Mars probe Launch Chang’e 4 China deploys important and carry out world’s programs like quantum first exploration on communication and far side of the Moon.
China,Innovation-oriented,innovation,"Innovation is “fl owing water”, making China’s seed of advanced ideas into towering trees."
China,Innovation-oriented,innovation,Innovation is “perpetual motion machine” advancing our development boldly.
Germany,Innovation-oriented,growth,"www.ki-strategie-deutschland.de 2 Introduction Artificial intelligence (AI)2 is a key technology which harbours great potential for additional economic growth and productivity gains - in Germany, Europe and worldwide."
Germany,Innovation-oriented,competitiveness,"The guiding principle behind the AI Strategy is a European AI ecosystem for innovation that enhances the competitiveness of European research, business and industry, promotes a wide range of different uses of AI in all areas of society in the interest of citizens and is rooted in common European rules and values."
Germany,Innovation-oriented,innovation,"The guiding principle behind the AI Strategy is a European AI ecosystem for innovation that enhances the competitiveness of European research, business and industry, promotes a wide range of different uses of AI in all areas of society in the interest of citizens and is rooted in common European rules and values."
Germany,Innovation-oriented,competitiveness,"Furthermore, the AI ecosystem will be based on a secure and sovereign data infrastructure, thus ensuring competitiveness."
Germany,Innovation-oriented,growth,"At the same time, the studies point to very dynamic growth in AI research throughout the world, which must prompt Germany to expand its research capacities if it is to keep up with international developments."
Germany,Innovation-oriented,innovation,"In cooperation with science and business communities with special emphasis on SMEs, this has allowed the Federal Government to boost Germany’s position as an international centre of AI innovation."
Germany,Innovation-oriented,investment,Legal certainty and incentives for the development and deployment of secure and trustworthy AI can reduce reservations and uncertainties among users and provide investment security for companies.
Germany,Innovation-oriented,innovation,"By setting clear rules, standards, the fundamental rights of citizens can be protected, trust in AI can be strengthened, sustainable deployment of AI as well as innovation and competition can be promoted."
Germany,Innovation-oriented,competitiveness,"To strengthen Germany in the fight against the COVID-19 pandemic and to lay the foundations for Germany’s competitiveness during and after the pandemic, the Federal Government has significantly stepped up its commitment to future technologies like AI once again."
Germany,Innovation-oriented,competitiveness,"These funds are to be used in particular to modernise the supercomputer infrastructure and increase computing capacities through new supercomputers, to promote the systematic digital provision of data from previously inaccessible data pools, to sustainably bolster AI centres of excellence and dovetail them with regional economy in application hubs, and to establish AI ecosystems of international appeal in order to lay the foundations for a European AI network and the competitiveness of AI “Made in Europe”."
Germany,Restriction/risk-oriented,compliance,"Within the framework of a broad public consultation and a host of expert discussions, the Federal Government is now developing a data strategy aiming inter alia to increase the provision and use of data for all stakeholders responsibly and in compliance with data protection regulations."
Germany,Innovation-oriented,investment,"On 8 April 2019, the High-Level Expert Group on Artificial Intelligence set up by the Commission published “Ethics Guidelines for Trustworthy AI” and on 26 June 2019 “Policy and Investment Recommendations for Trustworthy AI”."
Germany,Innovation-oriented,innovation,"Furthermore, the OECD has opened the AI Policy Observatory and put in place an extensive AI Programme on Work, Innovation, Productivity and Skills, which Germany is supporting significantly."
Germany,Innovation-oriented,innovation,"Furthermore, AI challenges are to be held that promote application-oriented AI innovation and lead to high international visibility through the dynamism this unleashes."
Germany,Innovation-oriented,innovation,"The Federal Government will continue to foster innovation in higher education through AI and big data, such as the AI-supported development of university courses or design of learning settings."
Germany,Innovation-oriented,innovation,"The aim is to establish a research and teaching network at German universities that pools different types of AI expertise locally, fosters innovation with local businesses in the regions and in association with application hubs, and is reputed at international level as a prestigious network, too."
Germany,Innovation-oriented,innovation,"In this context, there are also plans to establish additional innovation centres for smart mobility."
Germany,Innovation-oriented,acceleration,The ever-faster acceleration of technological developments is also impacting research and the translation of its findings into practice.
Germany,Innovation-oriented,innovation,The Federal Government is also creating new agility in research funding with initiatives such as the “Energy- efficient AI system” pilot innovation competition.
Germany,Innovation-oriented,innovation,"Beyond this, the Federal Government has set up the Agency for Innovation in Cyber Security (Cyber Agency), which will commission research projects - including on AI topics - to meet Germany’s domestic and external security needs in cyberspace."
Germany,Innovation-oriented,innovation,"In particular, it will continue to advance the networking between German AI centres of excellence and French AI institutes in the form of a joint Franco-German AI research and innovation network, at the same time always taking care to ensure that other European countries can join this."
Germany,Innovation-oriented,innovation,"By intensively funding applied research at universities of applied sciences, their role as an innovation driver in the different regions will be bolstered."
Germany,Innovation-oriented,leadership,The hub is designed to boost Germany’s innovativeness in the important markets for environmental and sustainability technologies and to secure the technological leadership of German businesses in the recycling sector.
Germany,Innovation-oriented,innovation,The Federal Government will be taking targeted action to shore up this development with innovation centres for smart mobility.
Germany,Innovation-oriented,competitiveness,Automated driving is a pillar of Germany’s competitiveness.
Germany,Innovation-oriented,competitiveness,Transfer and application The Federal Government’s measures to increase the transfer of AI knowledge into application serve to maintain the competitiveness of the German and European economy and expand it through the broad application of innovative technologies.
Germany,Innovation-oriented,competitiveness,"The international start-up funding programme German Accelerator will also make a significant contribution to competitiveness in the start-up sector thanks to its existing networks in Germany and its presence at the most important AI hubs worldwide (inter alia Silicon Valley, Boston for life sciences and Singapore in Asia)."
Germany,Innovation-oriented,growth,"Although there is considerable potential for efficiency gains and growth for businesses of all sizes, there is a need for political action mainly impart AI skills to SMEs."
Germany,Restriction/risk-oriented,compliance,"At EU level, the Federal Government is advocating that common framework conditions be put in place in the scope of a European health data space for the EU-wide secondary use of health data in compliance with data protection regulations."
Germany,Innovation-oriented,innovation,"Furthermore, the Federal Government is supporting the OECD programme Artificial Intelligence in Work, Innovation, Productivity and Skills (AI-WIPS), whose results and findings will make a major contribution to shaping the global AI debate."
Germany,Innovation-oriented,innovation,Testing in regulatory sandboxes (“Reallabore”) is important for the transfer of innovation and for the further development of the legal framework in order to strengthen innovation capacity in the field of AI.
Germany,Innovation-oriented,innovation,A major priority in the further implementation of the cross-cutting strategy on regulatory sandboxes as test spaces for innovation and regulation is to draw up specific proposals for strengthening the legal scope for testing in regulatory sandboxes on the basis of ongoing expert opinions (for instance on general experimentation clauses or on tools for wording experimentation clauses).
Germany,Innovation-oriented,innovation,"At the same time, regulatory sandboxes are supported by established networking and information services such as the Network of Regulatory Sandboxes, the Handbook for Regulatory Sandboxes and the Regulatory Sandboxes Innovation Prize, which will be continued and further developed to reflect new requirements arising from the field of practice."
Germany,Innovation-oriented,innovation,The Federal Government is supporting practical applications and digital test fields for the innovation cluster of AI in logistics by expanding and further developing its funding instrument.
Germany,Innovation-oriented,opportunity,"Using AI here is an opportunity not only to provide information and services in a more targeted, tailored and more easily accessible way within the administration and for the business and scientific communities, but also to support the goal of a climate-neutral federal administration by 2030."
Germany,Innovation-oriented,innovation,It will continue to develop the Centre of Excellence for Innovative Procurement (KOINNO) in order to permanently bolster the orientation towards innovation in public procurement in a way that is subject and technology neutral.
Germany,Restriction/risk-oriented,compliance,The Federal Government itself can support start-ups and SMEs with AI solutions by giving greater consideration to these in public contracts in compliance with the requirements under budgetary and public procurement law.
Germany,Restriction/risk-oriented,compliance,"In each specific use case, though, it must be examined whether and how AI can be deployed in a policing context in compliance with fundamental rights."
